[
  {
    "abstain_votes": null,
    "ai_summary": null,
    "amount_received": 0,
    "amount_requested": 18000000.0,
    "campaign_id": null,
    "challenge": null,
    "completed_at": null,
    "confidence": "medium",
    "currency": "USD",
    "definition_of_success": null,
    "external_ids": {},
    "field_confidence": {
      "amount_requested": "medium",
      "funding_status": "high",
      "no_votes": "medium",
      "yes_votes": "medium"
    },
    "fund": 1,
    "funded_at": null,
    "funding_status": "not_approved",
    "is_opensource": null,
    "links": {
      "catalyst_voices_url": null,
      "github_repo": null,
      "ideascale_url": null,
      "lidonation_url": null,
      "milestones_url": null,
      "projectcatalyst_io_url": null,
      "proposer_website": null
    },
    "milestone_count": null,
    "no_votes": 50000,
    "notes": "Fund 1 record derived from the staff-provided one-page voting-results PDF. The PDF is authoritative for result status but has limited proposal-detail fields.",
    "problem": null,
    "project_status": "unfunded",
    "proposal_id": "f01-abcd",
    "proposer_ids": [
      "p-f01-unknown-abcd"
    ],
    "ranking_total": null,
    "scores": null,
    "slug": "abcd",
    "solution": null,
    "sources": [
      {
        "fetched_at": "2026-05-15T18:38:42Z",
        "fields_provided": [
          "title",
          "amount_requested",
          "currency",
          "yes_votes",
          "no_votes",
          "funding_status",
          "project_status"
        ],
        "provenance_path": "data/_raw/iohk-pdfs/fund-01.pdf",
        "source": "iohk_voting_results_pdf",
        "url": null
      }
    ],
    "summary": null,
    "tags": [],
    "title": "ABCD",
    "yes_votes": 110000
  },
  {
    "abstain_votes": null,
    "ai_summary": null,
    "amount_received": 100000.0,
    "amount_requested": 100000.0,
    "campaign_id": null,
    "challenge": null,
    "completed_at": null,
    "confidence": "medium",
    "currency": "USD",
    "definition_of_success": null,
    "external_ids": {},
    "field_confidence": {
      "amount_requested": "medium",
      "funding_status": "high",
      "no_votes": "medium",
      "yes_votes": "medium"
    },
    "fund": 1,
    "funded_at": null,
    "funding_status": "approved",
    "is_opensource": null,
    "links": {
      "catalyst_voices_url": null,
      "github_repo": null,
      "ideascale_url": null,
      "lidonation_url": null,
      "milestones_url": null,
      "projectcatalyst_io_url": null,
      "proposer_website": null
    },
    "milestone_count": null,
    "no_votes": 20000,
    "notes": "Fund 1 record derived from the staff-provided one-page voting-results PDF. The PDF is authoritative for result status but has limited proposal-detail fields.",
    "problem": null,
    "project_status": "funded",
    "proposal_id": "f01-ada-makerspace",
    "proposer_ids": [
      "p-f01-unknown-ada-makerspace"
    ],
    "ranking_total": null,
    "scores": null,
    "slug": "ada-makerspace",
    "solution": null,
    "sources": [
      {
        "fetched_at": "2026-05-15T18:38:42Z",
        "fields_provided": [
          "title",
          "amount_requested",
          "currency",
          "yes_votes",
          "no_votes",
          "funding_status",
          "project_status"
        ],
        "provenance_path": "data/_raw/iohk-pdfs/fund-01.pdf",
        "source": "iohk_voting_results_pdf",
        "url": null
      }
    ],
    "summary": null,
    "tags": [],
    "title": "ADA MakerSpace",
    "yes_votes": 110000
  },
  {
    "abstain_votes": null,
    "ai_summary": null,
    "amount_received": 110000.0,
    "amount_requested": 110000.0,
    "campaign_id": null,
    "challenge": null,
    "completed_at": null,
    "confidence": "medium",
    "currency": "USD",
    "definition_of_success": null,
    "external_ids": {},
    "field_confidence": {
      "amount_requested": "medium",
      "funding_status": "high",
      "no_votes": "medium",
      "yes_votes": "medium"
    },
    "fund": 1,
    "funded_at": null,
    "funding_status": "approved",
    "is_opensource": null,
    "links": {
      "catalyst_voices_url": null,
      "github_repo": null,
      "ideascale_url": null,
      "lidonation_url": null,
      "milestones_url": null,
      "projectcatalyst_io_url": null,
      "proposer_website": null
    },
    "milestone_count": null,
    "no_votes": 30000,
    "notes": "Fund 1 record derived from the staff-provided one-page voting-results PDF. The PDF is authoritative for result status but has limited proposal-detail fields.",
    "problem": null,
    "project_status": "funded",
    "proposal_id": "f01-afrofinlab-podcast",
    "proposer_ids": [
      "p-f01-unknown-afrofinlab-podcast"
    ],
    "ranking_total": null,
    "scores": null,
    "slug": "afrofinlab-podcast",
    "solution": null,
    "sources": [
      {
        "fetched_at": "2026-05-15T18:38:42Z",
        "fields_provided": [
          "title",
          "amount_requested",
          "currency",
          "yes_votes",
          "no_votes",
          "funding_status",
          "project_status"
        ],
        "provenance_path": "data/_raw/iohk-pdfs/fund-01.pdf",
        "source": "iohk_voting_results_pdf",
        "url": null
      }
    ],
    "summary": null,
    "tags": [],
    "title": "AfroFinLab Podcast",
    "yes_votes": 120000
  },
  {
    "abstain_votes": null,
    "ai_summary": null,
    "amount_received": 0,
    "amount_requested": 0.0,
    "campaign_id": null,
    "challenge": null,
    "completed_at": null,
    "confidence": "medium",
    "currency": "USD",
    "definition_of_success": null,
    "external_ids": {},
    "field_confidence": {
      "amount_requested": "medium",
      "funding_status": "high",
      "no_votes": "medium",
      "yes_votes": "medium"
    },
    "fund": 1,
    "funded_at": null,
    "funding_status": "not_approved",
    "is_opensource": null,
    "links": {
      "catalyst_voices_url": null,
      "github_repo": null,
      "ideascale_url": null,
      "lidonation_url": null,
      "milestones_url": null,
      "projectcatalyst_io_url": null,
      "proposer_website": null
    },
    "milestone_count": null,
    "no_votes": 50000,
    "notes": "Fund 1 record derived from the staff-provided one-page voting-results PDF. The PDF is authoritative for result status but has limited proposal-detail fields.",
    "problem": null,
    "project_status": "unfunded",
    "proposal_id": "f01-bicameralism-voting-mechanism",
    "proposer_ids": [
      "p-f01-unknown-bicameralism-voting-mechanism"
    ],
    "ranking_total": null,
    "scores": null,
    "slug": "bicameralism-voting-mechanism",
    "solution": null,
    "sources": [
      {
        "fetched_at": "2026-05-15T18:38:42Z",
        "fields_provided": [
          "title",
          "amount_requested",
          "currency",
          "yes_votes",
          "no_votes",
          "funding_status",
          "project_status"
        ],
        "provenance_path": "data/_raw/iohk-pdfs/fund-01.pdf",
        "source": "iohk_voting_results_pdf",
        "url": null
      }
    ],
    "summary": null,
    "tags": [],
    "title": "Bicameralism Voting Mechanism",
    "yes_votes": 20000
  },
  {
    "abstain_votes": null,
    "ai_summary": null,
    "amount_received": 0,
    "amount_requested": 166666.0,
    "campaign_id": null,
    "challenge": null,
    "completed_at": null,
    "confidence": "medium",
    "currency": "USD",
    "definition_of_success": null,
    "external_ids": {},
    "field_confidence": {
      "amount_requested": "medium",
      "funding_status": "high",
      "no_votes": "medium",
      "yes_votes": "medium"
    },
    "fund": 1,
    "funded_at": null,
    "funding_status": "not_approved",
    "is_opensource": null,
    "links": {
      "catalyst_voices_url": null,
      "github_repo": null,
      "ideascale_url": null,
      "lidonation_url": null,
      "milestones_url": null,
      "projectcatalyst_io_url": null,
      "proposer_website": null
    },
    "milestone_count": null,
    "no_votes": 40000,
    "notes": "Fund 1 record derived from the staff-provided one-page voting-results PDF. The PDF is authoritative for result status but has limited proposal-detail fields.",
    "problem": null,
    "project_status": "unfunded",
    "proposal_id": "f01-blockdapps-weekly-podcast",
    "proposer_ids": [
      "p-f01-unknown-blockdapps-weekly-podcast"
    ],
    "ranking_total": null,
    "scores": null,
    "slug": "blockdapps-weekly-podcast",
    "solution": null,
    "sources": [
      {
        "fetched_at": "2026-05-15T18:38:42Z",
        "fields_provided": [
          "title",
          "amount_requested",
          "currency",
          "yes_votes",
          "no_votes",
          "funding_status",
          "project_status"
        ],
        "provenance_path": "data/_raw/iohk-pdfs/fund-01.pdf",
        "source": "iohk_voting_results_pdf",
        "url": null
      }
    ],
    "summary": null,
    "tags": [],
    "title": "BlockDApps weekly PODCAST",
    "yes_votes": 40000
  },
  {
    "abstain_votes": null,
    "ai_summary": null,
    "amount_received": 0,
    "amount_requested": 0.0,
    "campaign_id": null,
    "challenge": null,
    "completed_at": null,
    "confidence": "medium",
    "currency": "USD",
    "definition_of_success": null,
    "external_ids": {},
    "field_confidence": {
      "amount_requested": "medium",
      "funding_status": "high",
      "no_votes": "medium",
      "yes_votes": "medium"
    },
    "fund": 1,
    "funded_at": null,
    "funding_status": "not_approved",
    "is_opensource": null,
    "links": {
      "catalyst_voices_url": null,
      "github_repo": null,
      "ideascale_url": null,
      "lidonation_url": null,
      "milestones_url": null,
      "projectcatalyst_io_url": null,
      "proposer_website": null
    },
    "milestone_count": null,
    "no_votes": 70000,